Trade,Capital Intensity,Primary Funding Triggers,Seasonal/Event Triggers,Hiring Signals,Equipment/Fleet Signals,Typical Use of Funds,Likely Product Fit
Roofing,High,"Storm/hail damage surge, insurance-backed jobs, material price spikes, deposit-to-completion gaps","Spring/summer storm season, post-hurricane demand, hail events","Crews, foremen, sales/canvassers","Trucks, dump trailers, lifts, nail guns, safety gear","Materials upfront, payroll on large jobs, scaling crews","Working capital, materials funding, receivables bridge"
HVAC,High,"Peak-season demand spikes, equipment/inventory stocking, maintenance contract growth","Summer cooling + winter heating peaks","Technicians, installers, dispatchers","Service vans, diagnostic tools, unit inventory","Inventory/unit stocking, payroll, van purchases","Equipment finance, inventory/working capital, fleet finance"
Plumbing,Moderate-High,"Emergency call volume, commercial contract work, parts inventory","Winter freeze/burst-pipe spikes, construction season","Licensed plumbers, apprentices, dispatchers","Service trucks, jetters, cameras, tools","Parts inventory, payroll, truck additions","Working capital, equipment finance"
Electrical,Moderate-High,"Commercial/new-construction contracts, material costs (copper/panels), permit-driven backlog","Construction season, storm restoration","Licensed electricians, apprentices","Trucks, lifts, generators, tooling","Materials, payroll, bonding/contract ramp","Working capital, materials funding, equipment finance"
General Contracting,High,"Draw-schedule gaps, subcontractor payments, large project backlog, bonding","Construction season, weather delays","PMs, crews, estimators","Trucks, heavy tools, temporary equipment","Sub payments, materials, bridging draw delays","Receivables/draw bridge, working capital, project financing"
Landscaping/Hardscaping,Moderate-High,"Spring ramp staffing, equipment fleet, commercial maintenance contracts","Spring/summer peak, fall cleanup, winter slowdown","Crews, drivers, foremen","Mowers, skid steers, trucks, trailers","Equipment, spring payroll ramp, materials","Equipment finance, working capital, seasonal bridge"
Lawn Care,Moderate,"Spring fleet/equipment buildout, route expansion, seasonal payroll","Spring start, summer peak, winter gap","Seasonal crews, drivers","Mowers, trailers, trucks","Equipment, payroll ramp, marketing","Equipment finance, working capital"
Pest Control,Moderate-High,"Route/territory expansion, recurring-contract growth, chemical inventory","Spring/summer infestation peaks","Technicians, sales reps","Service vehicles, sprayers, equipment","Vehicles, chemical inventory, route acquisition","Equipment finance, working capital, acquisition funding"
Restoration (Water/Fire/Mold),High,"Insurance receivables (slow pay), disaster-driven surge, equipment scaling","Storm/flood/wildfire events, freeze season","Technicians, project managers","Air movers, dehumidifiers, trucks, containment gear","Bridging insurance receivables, equipment, payroll on surge","Receivables bridge, equipment finance, working capital"
Cleaning/Janitorial,Moderate,"Commercial contract wins (net-30/60), supplies, labor scaling","Year-round; back-to-office cycles","Cleaners, supervisors","Equipment, supplies, vehicles","Payroll on net-terms contracts, supplies","Receivables bridge, working capital"
Moving Companies,Moderate-High,"Peak-season fleet/labor, truck additions, storage expansion","Summer moving peak, month-end spikes","Movers, drivers","Box trucks, trailers, equipment","Trucks, seasonal labor, marketing","Fleet finance, working capital, equipment finance"
Trucking & Logistics,Very High,"Fuel cost float, factoring/receivables gaps, truck/trailer purchases, fleet expansion","Freight-rate cycles, peak shipping season","Drivers, dispatchers, mechanics","Tractors, trailers, telematics","Fuel float, truck purchases, driver payroll","Fleet finance, freight factoring/receivables bridge, working capital"
Last-Mile Delivery,Very High,"Fleet scaling for contracts, driver payroll, vehicle maintenance","Holiday/peak e-comm season","Drivers, dispatchers","Vans, telematics, maintenance","Vehicles, payroll, route ramp","Fleet finance, working capital"
Towing,Very High,"Truck purchases (high unit cost), 24/7 staffing, impound lot expansion","Winter accident spikes, storm events","Drivers/operators, dispatchers","Wreckers, flatbeds, heavy-duty units","Truck purchases, payroll, lot expansion","Equipment finance, fleet finance, working capital"
Septic,Very High,"Pump truck purchases, equipment, permit-driven jobs","Construction season, spring/fall service peaks","Drivers, technicians","Vacuum/pump trucks, excavation gear","Trucks, equipment, payroll","Equipment finance, working capital"
Concrete,Very High,"Material (cement/rebar) costs, equipment, large pour contracts, draw gaps","Construction season, weather windows","Crews, finishers, drivers","Mixers, pumps, forms, trucks","Materials upfront, equipment, payroll","Materials funding, equipment finance, draw bridge"
Paving/Asphalt,Very High,"Material price exposure, equipment, municipal/commercial contracts","Warm-season paving window","Crews, operators, drivers","Pavers, rollers, dump trucks","Materials, equipment, payroll on big jobs","Equipment finance, materials funding, working capital"
Excavation/Grading,Very High,"Heavy equipment purchases, fuel, site-work contracts, draw gaps","Construction season","Operators, laborers","Excavators, dozers, loaders, trucks","Equipment, fuel, payroll","Equipment finance, working capital, draw bridge"
Tree Service,High,"Storm-driven demand, equipment (chippers/cranes), crew scaling","Storm season, growing season, winter removals","Climbers, crews, drivers","Chippers, bucket trucks, cranes, saws","Equipment, payroll, surge staffing","Equipment finance, working capital"
Auto Repair,Moderate-High,"Equipment/lifts, parts inventory, bay/location expansion","Year-round; winter/seasonal repair spikes","Mechanics, service advisors","Lifts, diagnostic tools, alignment racks","Equipment, parts inventory, expansion","Equipment finance, working capital"
Handyman/Painting,Moderate,"Crew scaling, materials, seasonal project flow","Warm-season exterior work","Crews, subs","Vans, ladders, sprayers, tools","Materials, payroll, marketing","Working capital, equipment finance"
Well Drilling,Very High,"Rig/equipment costs, permit-driven jobs, rural demand","Construction & dry-season demand","Operators, crews","Drilling rigs, trucks, pumps","Equipment, materials, payroll","Equipment finance, working capital"
Snow Removal,Moderate-High,"Pre-season equipment buildout, seasonal contracts, on-call payroll","Winter season; pre-season prep in fall","Drivers, on-call crews","Plows, salt spreaders, trucks, salt inventory","Equipment, salt/material stocking, payroll","Equipment finance, seasonal working capital"
